{
  "$schema": "https://json-schema.org/draft/2020-12/schema",
  "$id": "https://jarvis.local/schemas/comms-log.schema.json",
  "title": "CommsLog",
  "description": "Row shape for public.comms_log",
  "type": "object",
  "required": ["id", "agent_id", "task_id", "created_at"],
  "additionalProperties": false,
  "properties": {
    "id": { "type": "string", "format": "uuid" },
    "agent_id": { "type": "string", "format": "uuid" },
    "task_id": { "type": "string", "format": "uuid" },
    "client": { "type": "string", "format": "uuid" },
    "message": { "type": "string" },
    "status": { "type": "string" },
    "created_at": { "type": "string", "format": "date-time" }
  }
}
