{
  "$schema": "../../schemas/comms-log.schema.json",
  "id": "00000000-0000-4000-8000-000000000010",
  "agent_id": "a1111111-1111-4111-8111-111111111111",
  "task_id": "00000000-0000-4000-8000-000000000001",
  "client": "00000000-0000-4000-8000-000000000010",
  "message": "Task queued for orchestration",
  "status": "sent",
  "created_at": "2026-01-01T00:00:00.000Z"
}
